{"$schema":"https://json-schema.org/draft/2020-12/schema","$id":"https://schemas.sourceos.org/syncd/orggov-state-integrity-binding.v0.1.schema.json","title":"OrgGov State Integrity Binding v0.1","type":"object","additionalProperties":false,"required":["schemaVersion","recordType","recordId","workroomRef","workOrderRef","actorRef","sessionRef","stateIntegrityReportRef","indexLaneRefs","policyDecisionRefs","eventRefs","repairPlanRefs","evidenceRefs","operatorNarrative","provenance"],"properties":{"schemaVersion":{"const":"orggov.state-integrity-binding.v0.1"},"recordType":{"const":"OrgGovStateIntegrityBinding"},"recordId":{"type":"string"},"workroomRef":{"type":"string"},"workOrderRef":{"type":"string"},"actorRef":{"type":"string"},"sessionRef":{"type":"string"},"stateIntegrityReportRef":{"type":"string"},"indexLaneRefs":{"type":"array","minItems":1,"items":{"type":"string"}},"policyDecisionRefs":{"type":"array","items":{"type":"string"}},"eventRefs":{"type":"array","minItems":1,"items":{"type":"string"}},"repairPlanRefs":{"type":"array","items":{"type":"string"}},"evidenceRefs":{"type":"array","minItems":1,"items":{"type":"string"}},"operatorNarrative":{"type":"object","additionalProperties":false,"required":["summary","why","nextAction","riskRemaining"],"properties":{"summary":{"type":"string"},"why":{"type":"string"},"nextAction":{"type":"string"},"riskRemaining":{"type":"string"}}},"provenance":{"type":"object","additionalProperties":false,"required":["createdBy","createdAt","nonSecret"],"properties":{"createdBy":{"type":"string"},"createdAt":{"type":"string"},"nonSecret":{"type":"boolean"}}},"labels":{"type":"object","additionalProperties":{"type":"string"}}}}
