{"schemaVersion":"orggov.state-integrity-binding.v0.1","recordType":"OrgGovStateIntegrityBinding","recordId":"orggov-state-integrity:prophet-platform-406","workroomRef":"workroom:orggov-v0","workOrderRef":"workorder:prophet-platform:406","actorRef":"actor:orggov-planning-agent","sessionRef":"agentplane://artifacts/orggov/session-artifact.json","stateIntegrityReportRef":"sourceos-syncd://reports/orggov-v0/state-integrity-report.json","indexLaneRefs":["sourceos-index-lane://policy","sourceos-index-lane://audit","sourceos-index-lane://repair"],"policyDecisionRefs":["github://SocioProphet/policy-fabric/pull/61","policydecision:allow-contract-spine"],"eventRefs":["sourceos-event://orggov/contract-spine-state-observed","sourceos-event://orggov/policy-block-expected"],"repairPlanRefs":["sourceos-repair-plan://orggov/no-destructive-repair-required"],"evidenceRefs":["github://SocioProphet/prophet-platform/issues/406","github://SocioProphet/agentplane/pull/128","github://SourceOS-Linux/sourceos-syncd/issues/13"],"operatorNarrative":{"summary":"OrgGov v0 work-order state is represented as local-first integrity evidence.","why":"The work order needs state, index-lane, policy-decision, event, and repair-plan context before agents can safely act against local substrates.","nextAction":"Promote the fixture into runtime state-integrity report emission once sourceos-syncd runtime endpoints are wired.","riskRemaining":"This is a fixture-level binding; live runtime emission and signed Lampstand attestation remain future work."},"provenance":{"createdBy":"sourceos-syncd://orggov-fixture","createdAt":"2026-05-07T05:10:00Z","nonSecret":true},"labels":{"program":"orggov-v0","parent":"SocioProphet/prophet-platform#406","sourceosIssue":"SourceOS-Linux/sourceos-syncd#13"}}
